{
  "$schema": "https://json-schema.org/draft/2020-12/schema",
  "id": "https://github.com/aica-technology/dynamic-components/schema/schema/component.schema.json",
  "title": "Dynamic Component Description",
  "description": "A full description of a dynamic component in the AICA application framework.",
  "type": "object",
  "properties": {
    "name": {
      "description": "The human-readable name of the component.",
      "type": "string"
    },
    "description": {
      "description": "The human-readable description of this component and its behaviour.",
      "type": "object",
      "properties": {
        "brief": {
          "description": "A brief (one-line) description of the component for quick reference and tool-tips.",
          "type": "string"
        },
        "details": {
          "description": "An optional detailed description of the component.",
          "type": "string"
        }
      },
      "required": [
        "brief"
      ]
    },
    "registration": {
      "$ref": "#/$defs/registration"
    },
    "is_lifecycle": {
      "description": "Specify if the component is a managed node with lifecycle states.",
      "type": "boolean"
    },
    "inherits": {
      "oneOf": [
        {
          "$ref": "#"
        },
        {
          "$ref": "#/$defs/registration"
        }
      ]
    },
    "inputs": {
      "description": "The fixed input signals (subscriptions) of the component.",
      "type": "array",
      "items": {
        "$ref": "signal.schema.json"
      },
      "uniqueItems": true
    },
    "input_collections": {
      "description": "The dynamically assignable input signals (subscriptions) of the component.",
      "type": "array",
      "items": {
        "$ref": "signal_collection.schema.json"
      },
      "uniqueItems": true
    },
    "outputs": {
      "description": "The output signals (publications) of the component.",
      "type": "array",
      "items": {
        "$ref": "signal.schema.json"
      },
      "uniqueItems": true
    },
    "parameters": {
      "description": "The parameters declared by the component.",
      "type": "array",
      "items": {
        "$ref": "parameter.schema.json"
      },
      "uniqueItems": true
    },
    "predicates": {
      "description": "The predicates provided by the component.",
      "type": "array",
      "items": {
        "$ref": "predicate.schema.json"
      },
      "uniqueItems": true
    },
    "services": {
      "description": "The services provided by the component.",
      "type": "array",
      "items": {
        "$ref": "service.schema.json"
      },
      "uniqueItems": true
    }
  },
  "required": [
    "name",
    "description",
    "registration",
    "is_lifecycle"
  ],
  "$defs": {
    "registration": {
      "description": "The registration details of the exported component required for run-time loading.",
      "type": "object",
      "properties": {
        "package": {
          "description": "The name of the package in which this component is defined.",
          "type": "string"
        },
        "class": {
          "description": "The fully qualified class name used to register the component.",
          "type": "string"
        }
      },
      "required": [
        "package",
        "class"
      ]
    }
  }
}